{
  "building": "A",
  "name": "Main Academic Building",
  "timezone": "Asia/Almaty",
  "viewBox": [
    0,
    0,
    600,
    1000
  ],
  "floors": [
    {
      "number": 1,
      "planKey": "a-f1",
      "outline": "M 418.4 14 L 447.2 16.3 L 476.3 29.3 L 498.2 51.6 L 516.2 93.3 L 536.9 184.6 L 549.9 269.3 L 561.4 393.8 L 563.3 523.8 L 553.3 642.6 L 539.9 731.5 L 523.8 806.2 L 491.6 918.2 L 474.4 952.3 L 457.1 969.5 L 426.9 984.5 L 398.5 986 L 375.9 981.8 L 343.7 966.8 L 193.4 863 L 135.6 843 L 137.5 828.9 L 117.2 818.5 L 98.4 803.2 L 78.8 782.5 L 58.1 752.2 L 45.9 720 L 41.7 685.9 L 48.6 595.8 L 55.1 572.8 L 57.4 479.7 L 54.3 431.4 L 46.3 408.8 L 38.2 347.8 L 36.7 301.5 L 40.1 273.5 L 53.2 240.5 L 71.9 214.1 L 94.6 191.5 L 86.1 168.5 L 331 40.8 L 382 21.3 Z",
      "zones": [
        {
          "id": "zone-north",
          "path": "M 418.4 14 L 447.2 16.3 L 476.3 29.3 L 498.2 51.6 L 516.2 93.3 L 536.9 184.6 L 549.9 269.3 L 561.4 393.8 L 562.1 440 L 54.9 440 L 54.3 431.4 L 46.3 408.8 L 38.2 347.8 L 36.7 301.5 L 40.1 273.5 L 53.2 240.5 L 71.9 214.1 L 94.6 191.5 L 86.1 168.5 L 331 40.8 L 382 21.3 Z"
        },
        {
          "id": "zone-hall",
          "path": "M 562.1 440 L 563.3 523.8 L 560.6 556 L 55.5 556 L 57.4 479.7 L 54.9 440 Z"
        },
        {
          "id": "zone-south",
          "path": "M 560.6 556 L 553.3 642.6 L 539.9 731.5 L 523.8 806.2 L 491.6 918.2 L 474.4 952.3 L 457.1 969.5 L 426.9 984.5 L 398.5 986 L 375.9 981.8 L 343.7 966.8 L 193.4 863 L 135.6 843 L 137.5 828.9 L 117.2 818.5 L 98.4 803.2 L 78.8 782.5 L 58.1 752.2 L 45.9 720 L 41.7 685.9 L 48.6 595.8 L 55.1 572.8 L 55.5 556 Z"
        }
      ],
      "corridors": [
        {
          "id": "corridor-north",
          "path": "M 56 440 L 496 440 L 496 468 L 56.6 468 L 56 457.9 Z"
        },
        {
          "id": "corridor-south",
          "path": "M 150 738 L 460 738 L 460 766 L 150 766 Z"
        }
      ],
      "rooms": [
        {
          "id": "3bfb7c4b-abed-55ae-bda2-4f33140cbe1f",
          "code": "ATRIUM-N",
          "name": "North Atrium",
          "type": "service",
          "wing": "north",
          "schedulable": false,
          "path": "M 418.4 14 L 447.2 16.3 L 476.3 29.3 L 498.2 51.6 L 516.2 93.3 L 536.9 184.6 L 549.9 269.3 L 561.4 393.8 L 562.1 442 L 55 442 L 54.3 431.4 L 46.3 408.8 L 38.2 347.8 L 36.7 301.5 L 40.1 273.5 L 53.2 240.5 L 71.9 214.1 L 94.6 191.5 L 86.1 168.5 L 331 40.8 L 382 21.3 Z",
          "bbox": {
            "x": 36.7,
            "y": 14,
            "w": 525.4,
            "h": 428
          },
          "label": {
            "x": 315,
            "y": 261.6
          }
        },
        {
          "id": "7355124b-9c1e-594e-a1a2-27ef93adb65a",
          "code": "CAFE",
          "name": "Cafe",
          "type": "service",
          "wing": "core",
          "schedulable": false,
          "path": "M 286.6 475.9 L 340.2 475.9 L 340.2 535.3 L 286.6 535.3 Z",
          "bbox": {
            "x": 286.6,
            "y": 475.9,
            "w": 53.6,
            "h": 59.4
          },
          "label": {
            "x": 313.4,
            "y": 505.6
          },
          "capacity": 120
        },
        {
          "id": "1747ad9c-565c-51d3-acd1-d0510a0fa03f",
          "code": "100",
          "name": "Assembly Hall",
          "type": "lecture",
          "wing": "south",
          "schedulable": true,
          "path": "M 52 600.8 L 99.5 606.6 L 108.4 605.4 L 109.9 607.7 L 162 613.1 L 163.9 613.8 L 164.3 616.9 L 165.5 615.4 L 165.1 633 L 161.6 634.9 L 157 661.7 L 156.7 667.5 L 158.6 670.9 L 156.7 684.4 L 154 685.5 L 151.7 693.2 L 152.1 695.5 L 153.6 693.2 L 153.6 695.9 L 155.1 693.2 L 155.5 700.1 L 153.6 705.1 L 149.8 703.5 L 147.1 706.6 L 141.7 729.6 L 141.7 738 L 133.3 768.7 L 126.4 775.6 L 129.1 782.9 L 126.8 784.8 L 127.1 785.9 L 128.7 783.6 L 123.7 799.7 L 121.8 801.3 L 123.7 802 L 121 803.2 L 123.7 803.6 L 124.5 808.9 L 122.5 811.6 L 114.9 812.4 L 83.8 782.9 L 81.1 778.6 L 82.7 777.5 L 78.8 776.3 L 63.1 754.1 L 52.8 733.4 L 53.9 732.7 L 50.5 724.6 L 46.3 700.1 L 45.1 678.2 L 46.3 649.9 Z",
          "bbox": {
            "x": 45.1,
            "y": 600.8,
            "w": 120.4,
            "h": 211.6
          },
          "label": {
            "x": 101.4,
            "y": 689.9
          },
          "capacity": 180
        },
        {
          "id": "1c2470b7-04cc-5e29-b33b-d35658471a4e",
          "code": "CR",
          "name": "Conference Room",
          "type": "seminar",
          "wing": "south",
          "schedulable": true,
          "path": "M 206.1 570.5 L 206.9 573.2 L 207.6 570.9 L 215.7 570.9 L 227.9 573.2 L 237.9 572.8 L 227.2 571.7 L 267.4 575.1 L 263.6 575.5 L 267.8 576.7 L 267 583.2 L 262.8 590.5 L 264.4 591.2 L 259.8 594.7 L 262.8 599.7 L 260.9 608.9 L 262.4 617.7 L 256.7 645.3 L 238.7 640.3 L 236 641.8 L 235.2 639.9 L 227.9 639.9 L 230.6 639.1 L 202.6 631.8 L 200 633 L 199.2 621.9 L 198 628 L 200.7 607.3 L 201.5 610.8 L 204.6 594.7 L 206.9 577 Z",
          "bbox": {
            "x": 198,
            "y": 570.5,
            "w": 69.8,
            "h": 74.8
          },
          "label": {
            "x": 233.1,
            "y": 605.9
          },
          "capacity": 24
        },
        {
          "id": "20a902e2-1ff1-5fc9-846e-8d7e0695fb20",
          "code": "CINEMA",
          "name": "Cinema",
          "type": "lecture",
          "wing": "south",
          "schedulable": false,
          "path": "M 198 637.6 L 257.8 651.8 L 255.9 654.1 L 256.7 657.9 L 247.1 719.6 L 249.4 726.1 L 247.5 730 L 243.7 730.7 L 245.2 731.5 L 244.4 738.8 L 244 736.9 L 241.7 739.2 L 185.8 721.9 Z",
          "bbox": {
            "x": 185.8,
            "y": 637.6,
            "w": 72,
            "h": 101.6
          },
          "label": {
            "x": 221.7,
            "y": 687.9
          },
          "capacity": 60
        },
        {
          "id": "aae5589e-535b-5b6e-8d79-cc6195bf2756",
          "code": "WC-1",
          "name": "Restrooms",
          "type": "service",
          "wing": "south",
          "schedulable": false,
          "path": "M 300 578.2 L 361.3 585.5 L 359.4 595.1 L 360.6 597 L 359 597.4 L 356.7 606.9 L 357.9 609.2 L 356 610.8 L 352.5 630.3 L 347.1 670.2 L 344.8 671.7 L 305 660.2 L 301.5 659.8 L 300.8 662.1 L 303.8 662.9 L 300.8 663.7 L 289.3 661 L 297.7 662.9 L 300.4 660.6 L 299.6 659.1 L 288.5 656 L 290.8 642.2 L 289.7 639.1 L 288.9 646.4 L 288.1 640.7 L 287 648.3 L 288.1 633.4 L 288.5 637.6 L 289.7 633 L 290.8 638.4 L 295 614.6 L 294.6 612.3 L 291.6 610.4 L 292.3 605.4 L 293.1 608.1 L 293.9 606.2 L 292.7 601.2 L 296.9 598.9 Z",
          "bbox": {
            "x": 287,
            "y": 578.2,
            "w": 74.3,
            "h": 93.5
          },
          "label": {
            "x": 324,
            "y": 622.8
          }
        },
        {
          "id": "57e682db-7caf-5d59-b9a0-871ae1259ead",
          "code": "WC-2",
          "name": "Restrooms",
          "type": "service",
          "wing": "south",
          "schedulable": false,
          "path": "M 287.4 662.5 L 345.2 677.5 L 331.4 775.2 L 326.4 773.7 L 323.8 776.3 L 315.7 772.9 L 315.3 769.8 L 308.4 765.6 L 277 753 L 275.5 751.8 L 275.5 747.6 L 272.8 745.7 L 273.2 738 L 276.2 737.3 L 277.8 734.6 L 285.1 684.4 L 284.3 669.8 Z",
          "bbox": {
            "x": 272.8,
            "y": 662.5,
            "w": 72.4,
            "h": 113.8
          },
          "label": {
            "x": 310.1,
            "y": 717.4
          }
        },
        {
          "id": "cb837303-1155-56a3-a6be-4e50f7d82c8e",
          "code": "101",
          "name": "Teaching Laboratory",
          "type": "lab",
          "wing": "south",
          "schedulable": true,
          "path": "M 144.8 749.5 L 159.7 753.3 L 162 751.8 L 169.3 753.3 L 232.5 774 L 225.6 803.2 L 220.7 807.4 L 221.4 808.5 L 224.1 805.5 L 225.6 807.4 L 229.1 807 L 229.5 809.7 L 227.9 811.6 L 224.1 811.6 L 220.3 808.9 L 222.6 812.8 L 220.3 823.9 L 218 830.8 L 216.8 827.3 L 217.6 831.5 L 213 846.5 L 212.2 845 L 211.1 850.3 L 205.3 854.2 L 206.5 860.3 L 204.6 864.1 L 168.9 848 L 140.2 840.7 L 142.1 825.4 L 129.4 821.2 L 121.8 816.6 L 124.8 811.6 L 122.9 811.6 L 124.8 808.9 L 124.1 803.9 L 127.1 802.4 L 127.1 805.5 L 128.7 805.9 L 134.8 783.2 L 137.9 777.9 Z",
          "bbox": {
            "x": 121.8,
            "y": 749.5,
            "w": 110.7,
            "h": 114.6
          },
          "label": {
            "x": 178.7,
            "y": 803.6
          },
          "capacity": 30
        },
        {
          "id": "821a2b02-eb12-544d-a262-f6925aa40768",
          "code": "102",
          "name": "Library",
          "type": "coworking",
          "wing": "south",
          "schedulable": false,
          "path": "M 244.4 775.2 L 250.6 778.6 L 252.5 777.9 L 252.9 780.6 L 253.2 778.6 L 257.5 782.5 L 252.5 803.6 L 254 807.4 L 259 807.8 L 259 809.7 L 262.1 811.6 L 266.7 808.9 L 275.1 817.4 L 283.9 822.7 L 295 828.1 L 299.6 827.3 L 299.6 829.6 L 313.8 836.9 L 315.3 836.1 L 317.2 839.6 L 317.6 842.7 L 314.9 843.4 L 312.3 850.7 L 314.6 853.4 L 310.7 857.2 L 306.5 866.8 L 307.3 869.1 L 297.3 901.3 L 296.9 899.8 L 295.8 902.1 L 295.8 906.7 L 293.5 909.7 L 298.5 913.2 L 296.9 915.1 L 288.9 915.5 L 289.7 924.7 L 283.9 922 L 282 918.5 L 278.9 918.5 L 275.9 912.8 L 262.1 904.4 L 263.2 904 L 255.9 899.8 L 252.5 895.5 L 242.9 892.1 L 240.6 887.9 L 229.5 880.6 L 229.1 878.7 L 226 878.3 L 227.2 877.9 L 211.8 868.7 L 208.4 868.7 L 208.4 866 L 210.3 866 L 214.9 860.3 L 223.7 833.5 L 224.9 834.6 L 227.2 816.6 L 228.7 815.8 L 227.6 812.4 L 229.9 812.8 L 231.4 810.1 L 238.3 776 L 238.7 777.5 Z",
          "bbox": {
            "x": 208.4,
            "y": 775.2,
            "w": 109.2,
            "h": 149.5
          },
          "label": {
            "x": 263.6,
            "y": 853.6
          },
          "capacity": 60
        },
        {
          "id": "c16b7d40-9f9e-5212-91bb-a447dc5ae6bd",